,Name,Brand,Colour,url,clean_text,tokenized,stopwords_removed,combined_postag_wnet,lemmatize_word_w_pos,lemmatize_text
562,Topman stretch skinny stacked zip jeans in black acid wash,Topman,Black acid wash,images.asos-media.com/products/topman-stretch-skinny-stacked-zip-jeans-in-black-acid-wash/202286198-1-blackacidwash,topman stretch skinny stacked zip jeans in black acid wash,"['topman', 'stretch', 'skinny', 'stacked', 'zip', 'jeans', 'in', 'black', 'acid', 'wash']","['topman', 'stretch', 'skinny', 'stacked', 'zip', 'jeans', 'black', 'acid', 'wash']","[('topman', 'n'), ('stretch', 'v'), ('skinny', 'n'), ('stacked', 'n'), ('zip', 'n'), ('jeans', 'n'), ('black', 'a'), ('acid', 'n'), ('wash', 'v')]","['topman', 'stretch', 'skinny', 'stacked', 'zip', 'jean', 'black', 'acid', 'wash']",topman stretch skinny stacked zip jean black acid wash
563,ASOS DESIGN stretch skinny shirt in blue check,ASOS DESIGN,BLUE,images.asos-media.com/products/asos-design-stretch-skinny-shirt-in-blue-check/201776702-1-blue,asos design stretch skinny shirt in blue check,"['asos', 'design', 'stretch', 'skinny', 'shirt', 'in', 'blue', 'check']","['asos', 'design', 'stretch', 'skinny', 'shirt', 'blue', 'check']","[('asos', 'n'), ('design', 'n'), ('stretch', 'v'), ('skinny', 'n'), ('shirt', 'n'), ('blue', 'a'), ('check', 'n')]","['asos', 'design', 'stretch', 'skinny', 'shirt', 'blue', 'check']",asos design stretch skinny shirt blue check
564,New Look funnel neck puffer gilet in stone,New Look,Stone,images.asos-media.com/products/new-look-funnel-neck-puffer-gilet-in-stone/203881714-1-stone,new look funnel neck puffer gilet in stone,"['new', 'look', 'funnel', 'neck', 'puffer', 'gilet', 'in', 'stone']","['new', 'look', 'funnel', 'neck', 'puffer', 'gilet', 'stone']","[('new', 'a'), ('look', 'n'), ('funnel', 'n'), ('neck', 'n'), ('puffer', 'n'), ('gilet', 'n'), ('stone', 'n')]","['new', 'look', 'funnel', 'neck', 'puffer', 'gilet', 'stone']",new look funnel neck puffer gilet stone
565,Noak 'Camden' slim premium fabric suit trousers in charcoal grey with stetch,Noak,CHARCOAL,images.asos-media.com/products/noak-camden-slim-premium-fabric-suit-trousers-in-charcoal-grey-with-stetch/202764192-1-charcoal,noak camden slim premium fabric suit trousers in charcoal grey with stetch,"['noak', 'camden', 'slim', 'premium', 'fabric', 'suit', 'trousers', 'in', 'charcoal', 'grey', 'with', 'stetch']","['noak', 'camden', 'slim', 'premium', 'fabric', 'suit', 'trousers', 'charcoal', 'grey', 'stetch']","[('noak', 'n'), ('camden', 'n'), ('slim', 'a'), ('premium', 'n'), ('fabric', 'n'), ('suit', 'n'), ('trousers', 'n'), ('charcoal', 'n'), ('grey', 'n'), ('stetch', 'n')]","['noak', 'camden', 'slim', 'premium', 'fabric', 'suit', 'trouser', 'charcoal', 'grey', 'stetch']",noak camden slim premium fabric suit trouser charcoal grey stetch
566,ASOS DESIGN head scarf in abstract blue floral print,ASOS DESIGN,MULTI,images.asos-media.com/products/asos-design-head-scarf-in-abstract-blue-floral-print/202671050-1-multi,asos design head scarf in abstract blue floral print,"['asos', 'design', 'head', 'scarf', 'in', 'abstract', 'blue', 'floral', 'print']","['asos', 'design', 'head', 'scarf', 'abstract', 'blue', 'floral', 'print']","[('asos', 'n'), ('design', 'n'), ('head', 'n'), ('scarf', 'n'), ('abstract', 'n'), ('blue', 'a'), ('floral', 'n'), ('print', 'n')]","['asos', 'design', 'head', 'scarf', 'abstract', 'blue', 'floral', 'print']",asos design head scarf abstract blue floral print
567,Puma Downtown towelling polo shirt in brown stripe - exclusive to ASOS,Puma,TIGERS EYE,images.asos-media.com/products/puma-downtown-towelling-polo-shirt-in-brown-stripe-exclusive-to-asos/202564393-1-tigerseye,puma downtown towelling polo shirt in brown stripe  exclusive to asos,"['puma', 'downtown', 'towelling', 'polo', 'shirt', 'in', 'brown', 'stripe', 'exclusive', 'to', 'asos']","['puma', 'downtown', 'towelling', 'polo', 'shirt', 'brown', 'stripe', 'exclusive', 'asos']","[('puma', 'n'), ('downtown', 'n'), ('towelling', 'n'), ('polo', 'n'), ('shirt', 'n'), ('brown', 'a'), ('stripe', 'n'), ('exclusive', 'a'), ('asos', 'n')]","['puma', 'downtown', 'towelling', 'polo', 'shirt', 'brown', 'stripe', 'exclusive', 'asos']",puma downtown towelling polo shirt brown stripe exclusive asos
568,Only & Sons t-shirt with contrast traping detail in white,Only & Sons,Bright White,images.asos-media.com/products/only-sons-t-shirt-with-contrast-traping-detail-in-white/203498733-1-brightwhite,only  sons tshirt with contrast traping detail in white,"['only', 'sons', 'tshirt', 'with', 'contrast', 'traping', 'detail', 'in', 'white']","['sons', 'tshirt', 'contrast', 'traping', 'detail', 'white']","[('sons', 'n'), ('tshirt', 'n'), ('contrast', 'n'), ('traping', 'n'), ('detail', 'n'), ('white', 'a')]","['son', 'tshirt', 'contrast', 'traping', 'detail', 'white']",son tshirt contrast traping detail white
569,Carhartt WIP michigan cord jacket in dark brown,Carhartt WIP,BROWN,images.asos-media.com/products/carhartt-wip-michigan-cord-jacket-in-dark-brown/203398090-1-brown,carhartt wip michigan cord jacket in dark brown,"['carhartt', 'wip', 'michigan', 'cord', 'jacket', 'in', 'dark', 'brown']","['carhartt', 'wip', 'michigan', 'cord', 'jacket', 'dark', 'brown']","[('carhartt', 'n'), ('wip', 'n'), ('michigan', 'n'), ('cord', 'n'), ('jacket', 'n'), ('dark', 'a'), ('brown', 'n')]","['carhartt', 'wip', 'michigan', 'cord', 'jacket', 'dark', 'brown']",carhartt wip michigan cord jacket dark brown
570,Jack & Jones Originals roll neck jumper in black,Jack & Jones,Black,images.asos-media.com/products/jack-jones-originals-roll-neck-jumper-in-black/203683004-1-black,jack  jones originals roll neck jumper in black,"['jack', 'jones', 'originals', 'roll', 'neck', 'jumper', 'in', 'black']","['jack', 'jones', 'originals', 'roll', 'neck', 'jumper', 'black']","[('jack', 'n'), ('jones', 'n'), ('originals', 'n'), ('roll', 'n'), ('neck', 'n'), ('jumper', 'n'), ('black', 'a')]","['jack', 'jones', 'original', 'roll', 'neck', 'jumper', 'black']",jack jones original roll neck jumper black
571,Polo Ralph Lauren x ASOS exclusive collab cap in cream with circle logo,Polo Ralph Lauren,CREAM,images.asos-media.com/products/polo-ralph-lauren-x-asos-exclusive-collab-cap-in-cream-with-circle-logo/203555360-1-cream,polo ralph lauren x asos exclusive collab cap in cream with circle logo,"['polo', 'ralph', 'lauren', 'x', 'asos', 'exclusive', 'collab', 'cap', 'in', 'cream', 'with', 'circle', 'logo']","['polo', 'ralph', 'lauren', 'x', 'asos', 'exclusive', 'collab', 'cap', 'cream', 'circle', 'logo']","[('polo', 'n'), ('ralph', 'n'), ('lauren', 'n'), ('x', 'n'), ('asos', 'n'), ('exclusive', 'a'), ('collab', 'n'), ('cap', 'n'), ('cream', 'n'), ('circle', 'n'), ('logo', 'n')]","['polo', 'ralph', 'lauren', 'x', 'asos', 'exclusive', 'collab', 'cap', 'cream', 'circle', 'logo']",polo ralph lauren x asos exclusive collab cap cream circle logo
572,River Island textured slim leg trousers in navy,River Island,NAVY,images.asos-media.com/products/river-island-textured-slim-leg-trousers-in-navy/203098114-1-navy,river island textured slim leg trousers in navy,"['river', 'island', 'textured', 'slim', 'leg', 'trousers', 'in', 'navy']","['river', 'island', 'textured', 'slim', 'leg', 'trousers', 'navy']","[('river', 'n'), ('island', 'n'), ('textured', 'n'), ('slim', 'a'), ('leg', 'n'), ('trousers', 'n'), ('navy', 'n')]","['river', 'island', 'textured', 'slim', 'leg', 'trouser', 'navy']",river island textured slim leg trouser navy
573,ASOS DESIGN slim tie in 90s gold paisley,ASOS DESIGN,GOLD,images.asos-media.com/products/asos-design-slim-tie-in-90s-gold-paisley/202929772-1-gold,asos design slim tie in 90s gold paisley,"['asos', 'design', 'slim', 'tie', 'in', '90s', 'gold', 'paisley']","['asos', 'design', 'slim', 'tie', '90s', 'gold', 'paisley']","[('asos', 'n'), ('design', 'n'), ('slim', 'a'), ('tie', 'n'), ('90s', 'n'), ('gold', 'a'), ('paisley', 'n')]","['asos', 'design', 'slim', 'tie', '90', 'gold', 'paisley']",asos design slim tie 90 gold paisley
574,ASOS DESIGN trucker cap with text badge in red and white,ASOS DESIGN,MULTI,images.asos-media.com/products/asos-design-trucker-cap-with-text-badge-in-red-and-white/202726336-1-multi,asos design trucker cap with text badge in red and white,"['asos', 'design', 'trucker', 'cap', 'with', 'text', 'badge', 'in', 'red', 'and', 'white']","['asos', 'design', 'trucker', 'cap', 'text', 'badge', 'red', 'white']","[('asos', 'n'), ('design', 'n'), ('trucker', 'n'), ('cap', 'n'), ('text', 'n'), ('badge', 'n'), ('red', 'a'), ('white', 'a')]","['asos', 'design', 'trucker', 'cap', 'text', 'badge', 'red', 'white']",asos design trucker cap text badge red white
575,ASOS DESIGN cord backpack in beige,ASOS DESIGN,KHAKI,images.asos-media.com/products/asos-design-cord-backpack-in-beige/202796446-1-khaki,asos design cord backpack in beige,"['asos', 'design', 'cord', 'backpack', 'in', 'beige']","['asos', 'design', 'cord', 'backpack', 'beige']","[('asos', 'n'), ('design', 'n'), ('cord', 'n'), ('backpack', 'n'), ('beige', 'n')]","['asos', 'design', 'cord', 'backpack', 'beige']",asos design cord backpack beige
576,ASOS DESIGN satin jacquard overhead shirt with ruffle cuff,ASOS DESIGN,BLACK,images.asos-media.com/products/asos-design-satin-jacquard-overhead-shirt-with-ruffle-cuff/202369781-1-black,asos design satin jacquard overhead shirt with ruffle cuff,"['asos', 'design', 'satin', 'jacquard', 'overhead', 'shirt', 'with', 'ruffle', 'cuff']","['asos', 'design', 'satin', 'jacquard', 'overhead', 'shirt', 'ruffle', 'cuff']","[('asos', 'n'), ('design', 'n'), ('satin', 'n'), ('jacquard', 'n'), ('overhead', 'n'), ('shirt', 'n'), ('ruffle', 'n'), ('cuff', 'n')]","['asos', 'design', 'satin', 'jacquard', 'overhead', 'shirt', 'ruffle', 'cuff']",asos design satin jacquard overhead shirt ruffle cuff
577,Berghaus Dolpa Zip off cargo trousers in beige,Berghaus,Beige,images.asos-media.com/products/berghaus-dolpa-zip-off-cargo-trousers-in-beige/201505785-1-beige,berghaus dolpa zip off cargo trousers in beige,"['berghaus', 'dolpa', 'zip', 'off', 'cargo', 'trousers', 'in', 'beige']","['berghaus', 'dolpa', 'zip', 'cargo', 'trousers', 'beige']","[('berghaus', 'n'), ('dolpa', 'n'), ('zip', 'n'), ('cargo', 'n'), ('trousers', 'n'), ('beige', 'n')]","['berghaus', 'dolpa', 'zip', 'cargo', 'trouser', 'beige']",berghaus dolpa zip cargo trouser beige
578,Topman straight wool mix herringbone suit trousers in brown,Topman,Brown,images.asos-media.com/products/topman-straight-wool-mix-herringbone-suit-trousers-in-brown/201990541-1-brown,topman straight wool mix herringbone suit trousers in brown,"['topman', 'straight', 'wool', 'mix', 'herringbone', 'suit', 'trousers', 'in', 'brown']","['topman', 'straight', 'wool', 'mix', 'herringbone', 'suit', 'trousers', 'brown']","[('topman', 'n'), ('straight', 'r'), ('wool', 'n'), ('mix', 'n'), ('herringbone', 'n'), ('suit', 'n'), ('trousers', 'n'), ('brown', 'a')]","['topman', 'straight', 'wool', 'mix', 'herringbone', 'suit', 'trouser', 'brown']",topman straight wool mix herringbone suit trouser brown
579,Dr Denim Reno tie dye long sleeve top in blue,Dr Denim,Blue,images.asos-media.com/products/dr-denim-reno-tie-dye-long-sleeve-top-in-blue/203724898-1-blue,dr denim reno tie dye long sleeve top in blue,"['dr', 'denim', 'reno', 'tie', 'dye', 'long', 'sleeve', 'top', 'in', 'blue']","['dr', 'denim', 'reno', 'tie', 'dye', 'long', 'sleeve', 'top', 'blue']","[('dr', 'n'), ('denim', 'n'), ('reno', 'n'), ('tie', 'n'), ('dye', 'n'), ('long', 'a'), ('sleeve', 'n'), ('top', 'n'), ('blue', 'a')]","['dr', 'denim', 'reno', 'tie', 'dye', 'long', 'sleeve', 'top', 'blue']",dr denim reno tie dye long sleeve top blue
580,ASOS DESIGN lace up shoes in black faux leather on raised chunky sole,ASOS DESIGN,BLACK,images.asos-media.com/products/asos-design-lace-up-shoes-in-black-faux-leather-on-raised-chunky-sole/202479385-1-black,asos design lace up shoes in black faux leather on raised chunky sole,"['asos', 'design', 'lace', 'up', 'shoes', 'in', 'black', 'faux', 'leather', 'on', 'raised', 'chunky', 'sole']","['asos', 'design', 'lace', 'shoes', 'black', 'faux', 'leather', 'raised', 'chunky', 'sole']","[('asos', 'n'), ('design', 'n'), ('lace', 'n'), ('shoes', 'n'), ('black', 'a'), ('faux', 'n'), ('leather', 'n'), ('raised', 'v'), ('chunky', 'n'), ('sole', 'n')]","['asos', 'design', 'lace', 'shoe', 'black', 'faux', 'leather', 'raise', 'chunky', 'sole']",asos design lace shoe black faux leather raise chunky sole
581,ASOS DESIGN wedding skinny blazer in cotton in navy,ASOS DESIGN,NAVY,images.asos-media.com/products/asos-design-wedding-skinny-blazer-in-cotton-in-navy/201322144-1-navy,asos design wedding skinny blazer in cotton in navy,"['asos', 'design', 'wedding', 'skinny', 'blazer', 'in', 'cotton', 'in', 'navy']","['asos', 'design', 'wedding', 'skinny', 'blazer', 'cotton', 'navy']","[('asos', 'n'), ('design', 'n'), ('wedding', 'n'), ('skinny', 'n'), ('blazer', 'n'), ('cotton', 'n'), ('navy', 'n')]","['asos', 'design', 'wedding', 'skinny', 'blazer', 'cotton', 'navy']",asos design wedding skinny blazer cotton navy
582,Herschel Supply Co Norman bucket hat in leopard print,Herschel Supply Co,LEOPARD PRINT,images.asos-media.com/products/herschel-supply-co-norman-bucket-hat-in-leopard-print/202927312-1-leopardprint,herschel supply co norman bucket hat in leopard print,"['herschel', 'supply', 'co', 'norman', 'bucket', 'hat', 'in', 'leopard', 'print']","['herschel', 'supply', 'co', 'norman', 'bucket', 'hat', 'leopard', 'print']","[('herschel', 'n'), ('supply', 'v'), ('co', 'n'), ('norman', 'n'), ('bucket', 'n'), ('hat', 'n'), ('leopard', 'n'), ('print', 'n')]","['herschel', 'supply', 'co', 'norman', 'bucket', 'hat', 'leopard', 'print']",herschel supply co norman bucket hat leopard print
583,ASOS DESIGN rimless fashion sunglasses with flame design in red ombre,ASOS DESIGN,RED,images.asos-media.com/products/asos-design-rimless-fashion-sunglasses-with-flame-design-in-red-ombre/201431586-1-red,asos design rimless fashion sunglasses with flame design in red ombre,"['asos', 'design', 'rimless', 'fashion', 'sunglasses', 'with', 'flame', 'design', 'in', 'red', 'ombre']","['asos', 'design', 'rimless', 'fashion', 'sunglasses', 'flame', 'design', 'red', 'ombre']","[('asos', 'n'), ('design', 'n'), ('rimless', 'n'), ('fashion', 'n'), ('sunglasses', 'n'), ('flame', 'n'), ('design', 'n'), ('red', 'a'), ('ombre', 'n')]","['asos', 'design', 'rimless', 'fashion', 'sunglass', 'flame', 'design', 'red', 'ombre']",asos design rimless fashion sunglass flame design red ombre
584,Jack & Jones Intelligence Pete skinny carrot jean with knee rips in blue black wash,Jack & Jones,Blue Denim,images.asos-media.com/products/jack-jones-intelligence-pete-skinny-carrot-jean-with-knee-rips-in-blue-black-wash/203572587-1-bluedenim,jack  jones intelligence pete skinny carrot jean with knee rips in blue black wash,"['jack', 'jones', 'intelligence', 'pete', 'skinny', 'carrot', 'jean', 'with', 'knee', 'rips', 'in', 'blue', 'black', 'wash']","['jack', 'jones', 'intelligence', 'pete', 'skinny', 'carrot', 'jean', 'knee', 'rips', 'blue', 'black', 'wash']","[('jack', 'n'), ('jones', 'n'), ('intelligence', 'n'), ('pete', 'n'), ('skinny', 'n'), ('carrot', 'n'), ('jean', 'n'), ('knee', 'n'), ('rips', 'n'), ('blue', 'a'), ('black', 'a'), ('wash', 'v')]","['jack', 'jones', 'intelligence', 'pete', 'skinny', 'carrot', 'jean', 'knee', 'rip', 'blue', 'black', 'wash']",jack jones intelligence pete skinny carrot jean knee rip blue black wash
585,Only & Sons loose fit joggers with taping detail in navy,Only & Sons,Dark Navy,images.asos-media.com/products/only-sons-loose-fit-joggers-with-taping-detail-in-navy/203498639-1-darknavy,only  sons loose fit joggers with taping detail in navy,"['only', 'sons', 'loose', 'fit', 'joggers', 'with', 'taping', 'detail', 'in', 'navy']","['sons', 'loose', 'fit', 'joggers', 'taping', 'detail', 'navy']","[('sons', 'n'), ('loose', 'r'), ('fit', 'a'), ('joggers', 'n'), ('taping', 'n'), ('detail', 'n'), ('navy', 'n')]","['son', 'loose', 'fit', 'jogger', 'taping', 'detail', 'navy']",son loose fit jogger taping detail navy
586,Nike Retro bomber jacket in green,Nike,BICOASTAL,images.asos-media.com/products/nike-retro-bomber-jacket-in-green/203434861-1-bicoastal,nike retro bomber jacket in green,"['nike', 'retro', 'bomber', 'jacket', 'in', 'green']","['nike', 'retro', 'bomber', 'jacket', 'green']","[('nike', 'n'), ('retro', 'n'), ('bomber', 'n'), ('jacket', 'n'), ('green', 'n')]","['nike', 'retro', 'bomber', 'jacket', 'green']",nike retro bomber jacket green
587,ASOS DESIGN oversized t-shirt in leopard flock print mesh,ASOS DESIGN,BLACK,images.asos-media.com/products/asos-design-oversized-t-shirt-in-leopard-flock-print-mesh/203344561-1-black,asos design oversized tshirt in leopard flock print mesh,"['asos', 'design', 'oversized', 'tshirt', 'in', 'leopard', 'flock', 'print', 'mesh']","['asos', 'design', 'oversized', 'tshirt', 'leopard', 'flock', 'print', 'mesh']","[('asos', 'n'), ('design', 'n'), ('oversized', 'n'), ('tshirt', 'n'), ('leopard', 'n'), ('flock', 'n'), ('print', 'n'), ('mesh', 'n')]","['asos', 'design', 'oversized', 'tshirt', 'leopard', 'flock', 'print', 'mesh']",asos design oversized tshirt leopard flock print mesh
588,adidas originals Essentials+ polyester fluffy hoodie in dark green,adidas Originals,dark green,images.asos-media.com/products/adidas-originals-essentials-polyester-fluffy-hoodie-in-dark-green/203295059-1-darkgreen,adidas originals essentials polyester fluffy hoodie in dark green,"['adidas', 'originals', 'essentials', 'polyester', 'fluffy', 'hoodie', 'in', 'dark', 'green']","['adidas', 'originals', 'essentials', 'polyester', 'fluffy', 'hoodie', 'dark', 'green']","[('adidas', 'n'), ('originals', 'n'), ('essentials', 'n'), ('polyester', 'n'), ('fluffy', 'n'), ('hoodie', 'n'), ('dark', 'a'), ('green', 'a')]","['adidas', 'original', 'essential', 'polyester', 'fluffy', 'hoodie', 'dark', 'green']",adidas original essential polyester fluffy hoodie dark green
589,Topman short sleeve smart stripe revere shirt,Topman,WHITE,images.asos-media.com/products/topman-short-sleeve-smart-stripe-revere-shirt/203061096-1-white,topman short sleeve smart stripe revere shirt,"['topman', 'short', 'sleeve', 'smart', 'stripe', 'revere', 'shirt']","['topman', 'short', 'sleeve', 'smart', 'stripe', 'revere', 'shirt']","[('topman', 'n'), ('short', 'a'), ('sleeve', 'n'), ('smart', 'n'), ('stripe', 'n'), ('revere', 'n'), ('shirt', 'n')]","['topman', 'short', 'sleeve', 'smart', 'stripe', 'revere', 'shirt']",topman short sleeve smart stripe revere shirt
590,Topman knitted texture button polo in brown stripe,Topman,Tan,images.asos-media.com/products/topman-knitted-texture-button-polo-in-brown-stripe/202905266-1-tan,topman knitted texture button polo in brown stripe,"['topman', 'knitted', 'texture', 'button', 'polo', 'in', 'brown', 'stripe']","['topman', 'knitted', 'texture', 'button', 'polo', 'brown', 'stripe']","[('topman', 'n'), ('knitted', 'n'), ('texture', 'n'), ('button', 'n'), ('polo', 'n'), ('brown', 'a'), ('stripe', 'n')]","['topman', 'knitted', 'texture', 'button', 'polo', 'brown', 'stripe']",topman knitted texture button polo brown stripe
591,ASOS DESIGN oversized t-shirt in blue ribbed velour mix colour block,ASOS DESIGN,BLUE,images.asos-media.com/products/asos-design-oversized-t-shirt-in-blue-ribbed-velour-mix-colour-block/202894567-1-blue,asos design oversized tshirt in blue ribbed velour mix colour block,"['asos', 'design', 'oversized', 'tshirt', 'in', 'blue', 'ribbed', 'velour', 'mix', 'colour', 'block']","['asos', 'design', 'oversized', 'tshirt', 'blue', 'ribbed', 'velour', 'mix', 'colour', 'block']","[('asos', 'n'), ('design', 'n'), ('oversized', 'n'), ('tshirt', 'n'), ('blue', 'a'), ('ribbed', 'n'), ('velour', 'n'), ('mix', 'n'), ('colour', 'n'), ('block', 'n')]","['asos', 'design', 'oversized', 'tshirt', 'blue', 'ribbed', 'velour', 'mix', 'colour', 'block']",asos design oversized tshirt blue ribbed velour mix colour block
592,ASOS DESIGN knitted sling bag in brown nep,ASOS DESIGN,BROWN,images.asos-media.com/products/asos-design-knitted-sling-bag-in-brown-nep/202748971-1-brown,asos design knitted sling bag in brown nep,"['asos', 'design', 'knitted', 'sling', 'bag', 'in', 'brown', 'nep']","['asos', 'design', 'knitted', 'sling', 'bag', 'brown', 'nep']","[('asos', 'n'), ('design', 'n'), ('knitted', 'n'), ('sling', 'n'), ('bag', 'n'), ('brown', 'a'), ('nep', 'n')]","['asos', 'design', 'knitted', 'sling', 'bag', 'brown', 'nep']",asos design knitted sling bag brown nep
593,ASOS DESIGN relaxed revere shirt in large scale geo print,ASOS DESIGN,BLUE,images.asos-media.com/products/asos-design-relaxed-revere-shirt-in-large-scale-geo-print/202652062-1-blue,asos design relaxed revere shirt in large scale geo print,"['asos', 'design', 'relaxed', 'revere', 'shirt', 'in', 'large', 'scale', 'geo', 'print']","['asos', 'design', 'relaxed', 'revere', 'shirt', 'large', 'scale', 'geo', 'print']","[('asos', 'n'), ('design', 'n'), ('relaxed', 'n'), ('revere', 'n'), ('shirt', 'n'), ('large', 'a'), ('scale', 'n'), ('geo', 'n'), ('print', 'n')]","['asos', 'design', 'relaxed', 'revere', 'shirt', 'large', 'scale', 'geo', 'print']",asos design relaxed revere shirt large scale geo print
594,ASOS DESIGN regular viscose shirt in teal with deep revere,ASOS DESIGN,TEAL,images.asos-media.com/products/asos-design-regular-viscose-shirt-in-teal-with-deep-revere/202440708-1-teal,asos design regular viscose shirt in teal with deep revere,"['asos', 'design', 'regular', 'viscose', 'shirt', 'in', 'teal', 'with', 'deep', 'revere']","['asos', 'design', 'regular', 'viscose', 'shirt', 'teal', 'deep', 'revere']","[('asos', 'n'), ('design', 'n'), ('regular', 'a'), ('viscose', 'n'), ('shirt', 'n'), ('teal', 'n'), ('deep', 'r'), ('revere', 'n')]","['asos', 'design', 'regular', 'viscose', 'shirt', 'teal', 'deep', 'revere']",asos design regular viscose shirt teal deep revere
595,ASOS DESIGN oversized t-shirt in grey colour block with San Francisco city print,ASOS DESIGN,PURPLE,images.asos-media.com/products/asos-design-oversized-t-shirt-in-grey-colour-block-with-san-francisco-city-print/202111338-1-purple,asos design oversized tshirt in grey colour block with san francisco city print,"['asos', 'design', 'oversized', 'tshirt', 'in', 'grey', 'colour', 'block', 'with', 'san', 'francisco', 'city', 'print']","['asos', 'design', 'oversized', 'tshirt', 'grey', 'colour', 'block', 'san', 'francisco', 'city', 'print']","[('asos', 'n'), ('design', 'n'), ('oversized', 'n'), ('tshirt', 'n'), ('grey', 'n'), ('colour', 'n'), ('block', 'n'), ('san', 'n'), ('francisco', 'n'), ('city', 'n'), ('print', 'n')]","['asos', 'design', 'oversized', 'tshirt', 'grey', 'colour', 'block', 'san', 'francisco', 'city', 'print']",asos design oversized tshirt grey colour block san francisco city print
596,ASOS DESIGN skinny tie in pink and navy floral,ASOS DESIGN,MULTI,images.asos-media.com/products/asos-design-skinny-tie-in-pink-and-navy-floral/202084899-1-multi,asos design skinny tie in pink and navy floral,"['asos', 'design', 'skinny', 'tie', 'in', 'pink', 'and', 'navy', 'floral']","['asos', 'design', 'skinny', 'tie', 'pink', 'navy', 'floral']","[('asos', 'n'), ('design', 'n'), ('skinny', 'n'), ('tie', 'n'), ('pink', 'a'), ('navy', 'n'), ('floral', 'n')]","['asos', 'design', 'skinny', 'tie', 'pink', 'navy', 'floral']",asos design skinny tie pink navy floral
597,Farah Vere back print cotton t-shirt in navy,Farah,Navy,images.asos-media.com/products/farah-vere-back-print-cotton-t-shirt-in-navy/203510932-1-navy,farah vere back print cotton tshirt in navy,"['farah', 'vere', 'back', 'print', 'cotton', 'tshirt', 'in', 'navy']","['farah', 'vere', 'back', 'print', 'cotton', 'tshirt', 'navy']","[('farah', 'n'), ('vere', 'n'), ('back', 'r'), ('print', 'n'), ('cotton', 'n'), ('tshirt', 'n'), ('navy', 'n')]","['farah', 'vere', 'back', 'print', 'cotton', 'tshirt', 'navy']",farah vere back print cotton tshirt navy
598,Topman crochet revere shirt in multi,Topman,MULTI STRIPE,images.asos-media.com/products/topman-crochet-revere-shirt-in-multi/203261493-1-multistripe,topman crochet revere shirt in multi,"['topman', 'crochet', 'revere', 'shirt', 'in', 'multi']","['topman', 'crochet', 'revere', 'shirt', 'multi']","[('topman', 'n'), ('crochet', 'n'), ('revere', 'n'), ('shirt', 'n'), ('multi', 'n')]","['topman', 'crochet', 'revere', 'shirt', 'multi']",topman crochet revere shirt multi
599,Dr Denim Omar wide leg shorts in black,Dr Denim,Black,images.asos-media.com/products/dr-denim-omar-wide-leg-shorts-in-black/202452280-1-black,dr denim omar wide leg shorts in black,"['dr', 'denim', 'omar', 'wide', 'leg', 'shorts', 'in', 'black']","['dr', 'denim', 'omar', 'wide', 'leg', 'shorts', 'black']","[('dr', 'n'), ('denim', 'n'), ('omar', 'n'), ('wide', 'a'), ('leg', 'n'), ('shorts', 'n'), ('black', 'a')]","['dr', 'denim', 'omar', 'wide', 'leg', 'short', 'black']",dr denim omar wide leg short black
600,ASOS DESIGN puffer gilet in stone with contrast black yoke,ASOS DESIGN,NEUTRAL,images.asos-media.com/products/asos-design-puffer-gilet-in-stone-with-contrast-black-yoke/201504505-1-neutral,asos design puffer gilet in stone with contrast black yoke,"['asos', 'design', 'puffer', 'gilet', 'in', 'stone', 'with', 'contrast', 'black', 'yoke']","['asos', 'design', 'puffer', 'gilet', 'stone', 'contrast', 'black', 'yoke']","[('asos', 'n'), ('design', 'n'), ('puffer', 'n'), ('gilet', 'n'), ('stone', 'n'), ('contrast', 'n'), ('black', 'a'), ('yoke', 'n')]","['asos', 'design', 'puffer', 'gilet', 'stone', 'contrast', 'black', 'yoke']",asos design puffer gilet stone contrast black yoke
