,Name,Brand,Colour,url,clean_text,tokenized,stopwords_removed,combined_postag_wnet,lemmatize_word_w_pos,lemmatize_text
882,ASOS DESIGN oversized half zip sweatshirt in black faux fur,ASOS DESIGN,BLACK,images.asos-media.com/products/asos-design-oversized-half-zip-sweatshirt-in-black-faux-fur/202756081-1-black,asos design oversized half zip sweatshirt in black faux fur,"['asos', 'design', 'oversized', 'half', 'zip', 'sweatshirt', 'in', 'black', 'faux', 'fur']","['asos', 'design', 'oversized', 'half', 'zip', 'sweatshirt', 'black', 'faux', 'fur']","[('asos', 'n'), ('design', 'n'), ('oversized', 'n'), ('half', 'n'), ('zip', 'n'), ('sweatshirt', 'n'), ('black', 'a'), ('faux', 'n'), ('fur', 'n')]","['asos', 'design', 'oversized', 'half', 'zip', 'sweatshirt', 'black', 'faux', 'fur']",asos design oversized half zip sweatshirt black faux fur
883,ASOS DESIGN dropped shoulder oversized revere shirt with abstract design,ASOS DESIGN,BLUE,images.asos-media.com/products/asos-design-dropped-shoulder-oversized-revere-shirt-with-abstract-design/201930973-1-blue,asos design dropped shoulder oversized revere shirt with abstract design,"['asos', 'design', 'dropped', 'shoulder', 'oversized', 'revere', 'shirt', 'with', 'abstract', 'design']","['asos', 'design', 'dropped', 'shoulder', 'oversized', 'revere', 'shirt', 'abstract', 'design']","[('asos', 'n'), ('design', 'n'), ('dropped', 'v'), ('shoulder', 'n'), ('oversized', 'n'), ('revere', 'n'), ('shirt', 'n'), ('abstract', 'n'), ('design', 'n')]","['asos', 'design', 'drop', 'shoulder', 'oversized', 'revere', 'shirt', 'abstract', 'design']",asos design drop shoulder oversized revere shirt abstract design
884,Topman patchwork overshirt in denim blues,Topman,BLUES,images.asos-media.com/products/topman-patchwork-overshirt-in-denim-blues/202585106-1-blues,topman patchwork overshirt in denim blues,"['topman', 'patchwork', 'overshirt', 'in', 'denim', 'blues']","['topman', 'patchwork', 'overshirt', 'denim', 'blues']","[('topman', 'n'), ('patchwork', 'n'), ('overshirt', 'n'), ('denim', 'n'), ('blues', 'n')]","['topman', 'patchwork', 'overshirt', 'denim', 'blue']",topman patchwork overshirt denim blue
885,Vans Torrey jacket in beige Exclusive at asos,Vans,NEUTRAL,images.asos-media.com/products/vans-torrey-jacket-in-beige-exclusive-at-asos/203238734-1-neutral,vans torrey jacket in beige exclusive at asos,"['vans', 'torrey', 'jacket', 'in', 'beige', 'exclusive', 'at', 'asos']","['vans', 'torrey', 'jacket', 'beige', 'exclusive', 'asos']","[('vans', 'n'), ('torrey', 'n'), ('jacket', 'n'), ('beige', 'n'), ('exclusive', 'a'), ('asos', 'n')]","['van', 'torrey', 'jacket', 'beige', 'exclusive', 'asos']",van torrey jacket beige exclusive asos
886,Dickies 3 pack t-shirt in black,Dickies,Black,images.asos-media.com/products/dickies-3-pack-t-shirt-in-black/203462112-1-black,dickies 3 pack tshirt in black,"['dickies', '3', 'pack', 'tshirt', 'in', 'black']","['dickies', '3', 'pack', 'tshirt', 'black']","[('dickies', 'n'), ('3', 'n'), ('pack', 'n'), ('tshirt', 'n'), ('black', 'a')]","['dicky', '3', 'pack', 'tshirt', 'black']",dicky 3 pack tshirt black
887,The North Face Seasonal Mountain water repellent jacket in khaki and black Exclusive at ASOS,The North Face,Khaki and Black,images.asos-media.com/products/the-north-face-seasonal-mountain-water-repellent-jacket-in-khaki-and-black-exclusive-at-asos/203192650-1-khakiandblack,the north face seasonal mountain water repellent jacket in khaki and black exclusive at asos,"['the', 'north', 'face', 'seasonal', 'mountain', 'water', 'repellent', 'jacket', 'in', 'khaki', 'and', 'black', 'exclusive', 'at', 'asos']","['north', 'face', 'seasonal', 'mountain', 'water', 'repellent', 'jacket', 'khaki', 'black', 'exclusive', 'asos']","[('north', 'n'), ('face', 'v'), ('seasonal', 'a'), ('mountain', 'n'), ('water', 'n'), ('repellent', 'n'), ('jacket', 'n'), ('khaki', 'n'), ('black', 'a'), ('exclusive', 'a'), ('asos', 'n')]","['north', 'face', 'seasonal', 'mountain', 'water', 'repellent', 'jacket', 'khaki', 'black', 'exclusive', 'asos']",north face seasonal mountain water repellent jacket khaki black exclusive asos
888,ASOS DESIGN wide fit shorts in coral cord,ASOS DESIGN,Desert flower,images.asos-media.com/products/asos-design-wide-fit-shorts-in-coral-cord/201877191-1-desertflower,asos design wide fit shorts in coral cord,"['asos', 'design', 'wide', 'fit', 'shorts', 'in', 'coral', 'cord']","['asos', 'design', 'wide', 'fit', 'shorts', 'coral', 'cord']","[('asos', 'n'), ('design', 'n'), ('wide', 'a'), ('fit', 'a'), ('shorts', 'n'), ('coral', 'n'), ('cord', 'n')]","['asos', 'design', 'wide', 'fit', 'short', 'coral', 'cord']",asos design wide fit short coral cord
889,ASOS DESIGN oversized t-shirt in light blue with varsity back print,ASOS DESIGN,FORGET ME NOT,images.asos-media.com/products/asos-design-oversized-t-shirt-in-light-blue-with-varsity-back-print/203642522-1-forgetmenot,asos design oversized tshirt in light blue with varsity back print,"['asos', 'design', 'oversized', 'tshirt', 'in', 'light', 'blue', 'with', 'varsity', 'back', 'print']","['asos', 'design', 'oversized', 'tshirt', 'light', 'blue', 'varsity', 'back', 'print']","[('asos', 'n'), ('design', 'n'), ('oversized', 'n'), ('tshirt', 'n'), ('light', 'a'), ('blue', 'a'), ('varsity', 'n'), ('back', 'r'), ('print', 'n')]","['asos', 'design', 'oversized', 'tshirt', 'light', 'blue', 'varsity', 'back', 'print']",asos design oversized tshirt light blue varsity back print
890,ASOS DESIGN tapered wool mix smart trousers in stone herringbone,ASOS DESIGN,STONE,images.asos-media.com/products/asos-design-tapered-wool-mix-smart-trousers-in-stone-herringbone/202235279-1-stone,asos design tapered wool mix smart trousers in stone herringbone,"['asos', 'design', 'tapered', 'wool', 'mix', 'smart', 'trousers', 'in', 'stone', 'herringbone']","['asos', 'design', 'tapered', 'wool', 'mix', 'smart', 'trousers', 'stone', 'herringbone']","[('asos', 'n'), ('design', 'n'), ('tapered', 'n'), ('wool', 'n'), ('mix', 'n'), ('smart', 'n'), ('trousers', 'n'), ('stone', 'n'), ('herringbone', 'n')]","['asos', 'design', 'tapered', 'wool', 'mix', 'smart', 'trouser', 'stone', 'herringbone']",asos design tapered wool mix smart trouser stone herringbone
891,COLLUSION crochet knitted vest in orange,Collusion,ORANGE,images.asos-media.com/products/collusion-crochet-knitted-vest-in-orange/203575209-1-orange,collusion crochet knitted vest in orange,"['collusion', 'crochet', 'knitted', 'vest', 'in', 'orange']","['collusion', 'crochet', 'knitted', 'vest', 'orange']","[('collusion', 'n'), ('crochet', 'n'), ('knitted', 'n'), ('vest', 'n'), ('orange', 'a')]","['collusion', 'crochet', 'knitted', 'vest', 'orange']",collusion crochet knitted vest orange
892,ellesse sweat with branding in green,ellesse,GREEN,images.asos-media.com/products/ellesse-sweat-with-branding-in-green/203227411-1-green,ellesse sweat with branding in green,"['ellesse', 'sweat', 'with', 'branding', 'in', 'green']","['ellesse', 'sweat', 'branding', 'green']","[('ellesse', 'n'), ('sweat', 'n'), ('branding', 'n'), ('green', 'n')]","['ellesse', 'sweat', 'branding', 'green']",ellesse sweat branding green
893,COLLUSION boxy revere cotton shirt in white,Collusion,WHITE,images.asos-media.com/products/collusion-boxy-revere-cotton-shirt-in-white/202406910-1-white,collusion boxy revere cotton shirt in white,"['collusion', 'boxy', 'revere', 'cotton', 'shirt', 'in', 'white']","['collusion', 'boxy', 'revere', 'cotton', 'shirt', 'white']","[('collusion', 'n'), ('boxy', 'a'), ('revere', 'n'), ('cotton', 'n'), ('shirt', 'n'), ('white', 'a')]","['collusion', 'boxy', 'revere', 'cotton', 'shirt', 'white']",collusion boxy revere cotton shirt white
894,ASOS DESIGN super skinny suit jacket in white,ASOS DESIGN,WHITE,images.asos-media.com/products/asos-design-super-skinny-suit-jacket-in-white/201146573-1-white,asos design super skinny suit jacket in white,"['asos', 'design', 'super', 'skinny', 'suit', 'jacket', 'in', 'white']","['asos', 'design', 'super', 'skinny', 'suit', 'jacket', 'white']","[('asos', 'n'), ('design', 'n'), ('super', 'a'), ('skinny', 'n'), ('suit', 'n'), ('jacket', 'n'), ('white', 'a')]","['asos', 'design', 'super', 'skinny', 'suit', 'jacket', 'white']",asos design super skinny suit jacket white
895,New Look tapered smart trouser with front pleats in black check,New Look,Black Pattern,images.asos-media.com/products/new-look-tapered-smart-trouser-with-front-pleats-in-black-check/203742721-1-blackpattern,new look tapered smart trouser with front pleats in black check,"['new', 'look', 'tapered', 'smart', 'trouser', 'with', 'front', 'pleats', 'in', 'black', 'check']","['new', 'look', 'tapered', 'smart', 'trouser', 'front', 'pleats', 'black', 'check']","[('new', 'a'), ('look', 'n'), ('tapered', 'n'), ('smart', 'n'), ('trouser', 'n'), ('front', 'n'), ('pleats', 'n'), ('black', 'a'), ('check', 'n')]","['new', 'look', 'tapered', 'smart', 'trouser', 'front', 'pleat', 'black', 'check']",new look tapered smart trouser front pleat black check
896,New Look atheletics track club in white,New Look,White,images.asos-media.com/products/new-look-atheletics-track-club-in-white/203374066-1-white,new look atheletics track club in white,"['new', 'look', 'atheletics', 'track', 'club', 'in', 'white']","['new', 'look', 'atheletics', 'track', 'club', 'white']","[('new', 'a'), ('look', 'n'), ('atheletics', 'n'), ('track', 'n'), ('club', 'n'), ('white', 'a')]","['new', 'look', 'atheletics', 'track', 'club', 'white']",new look atheletics track club white
897,The North Face NSE chest print t-shirt in khaki Exclusive at ASOS,The North Face,Khaki,images.asos-media.com/products/the-north-face-nse-chest-print-t-shirt-in-khaki-exclusive-at-asos/202942243-1-khaki,the north face nse chest print tshirt in khaki exclusive at asos,"['the', 'north', 'face', 'nse', 'chest', 'print', 'tshirt', 'in', 'khaki', 'exclusive', 'at', 'asos']","['north', 'face', 'nse', 'chest', 'print', 'tshirt', 'khaki', 'exclusive', 'asos']","[('north', 'n'), ('face', 'v'), ('nse', 'n'), ('chest', 'n'), ('print', 'n'), ('tshirt', 'n'), ('khaki', 'n'), ('exclusive', 'a'), ('asos', 'n')]","['north', 'face', 'nse', 'chest', 'print', 'tshirt', 'khaki', 'exclusive', 'asos']",north face nse chest print tshirt khaki exclusive asos
898,ASOS DESIGN shorts dungarees in neutral colour block cord,ASOS DESIGN,Multi,images.asos-media.com/products/asos-design-shorts-dungarees-in-neutral-colour-block-cord/201944532-1-multi,asos design shorts dungarees in neutral colour block cord,"['asos', 'design', 'shorts', 'dungarees', 'in', 'neutral', 'colour', 'block', 'cord']","['asos', 'design', 'shorts', 'dungarees', 'neutral', 'colour', 'block', 'cord']","[('asos', 'n'), ('design', 'n'), ('shorts', 'n'), ('dungarees', 'n'), ('neutral', 'a'), ('colour', 'n'), ('block', 'n'), ('cord', 'n')]","['asos', 'design', 'short', 'dungaree', 'neutral', 'colour', 'block', 'cord']",asos design short dungaree neutral colour block cord
899,ASOS DESIGN regular smart linen shirt with mandarin collar in pale grey,ASOS DESIGN,LIGHT GREY,images.asos-media.com/products/asos-design-regular-smart-linen-shirt-with-mandarin-collar-in-pale-grey/201924522-1-lightgrey,asos design regular smart linen shirt with mandarin collar in pale grey,"['asos', 'design', 'regular', 'smart', 'linen', 'shirt', 'with', 'mandarin', 'collar', 'in', 'pale', 'grey']","['asos', 'design', 'regular', 'smart', 'linen', 'shirt', 'mandarin', 'collar', 'pale', 'grey']","[('asos', 'n'), ('design', 'n'), ('regular', 'a'), ('smart', 'n'), ('linen', 'n'), ('shirt', 'n'), ('mandarin', 'n'), ('collar', 'n'), ('pale', 'n'), ('grey', 'n')]","['asos', 'design', 'regular', 'smart', 'linen', 'shirt', 'mandarin', 'collar', 'pale', 'grey']",asos design regular smart linen shirt mandarin collar pale grey
900,Pull&Bear smart wide leg trousers in navy,Pull&Bear,NAVY,images.asos-media.com/products/pullbear-smart-wide-leg-trousers-in-navy/203742900-1-navy,pullbear smart wide leg trousers in navy,"['pullbear', 'smart', 'wide', 'leg', 'trousers', 'in', 'navy']","['pullbear', 'smart', 'wide', 'leg', 'trousers', 'navy']","[('pullbear', 'n'), ('smart', 'n'), ('wide', 'a'), ('leg', 'n'), ('trousers', 'n'), ('navy', 'n')]","['pullbear', 'smart', 'wide', 'leg', 'trouser', 'navy']",pullbear smart wide leg trouser navy
901,Vans Unisex Hi def logo back print t-shirt in black,Vans,BLACK,images.asos-media.com/products/vans-unisex-hi-def-logo-back-print-t-shirt-in-black/203222934-1-black,vans unisex hi def logo back print tshirt in black,"['vans', 'unisex', 'hi', 'def', 'logo', 'back', 'print', 'tshirt', 'in', 'black']","['vans', 'unisex', 'hi', 'def', 'logo', 'back', 'print', 'tshirt', 'black']","[('vans', 'n'), ('unisex', 'n'), ('hi', 'n'), ('def', 'n'), ('logo', 'n'), ('back', 'r'), ('print', 'n'), ('tshirt', 'n'), ('black', 'a')]","['van', 'unisex', 'hi', 'def', 'logo', 'back', 'print', 'tshirt', 'black']",van unisex hi def logo back print tshirt black
902,Dickies Camden Box t-shirt in green,Dickies,Green,images.asos-media.com/products/dickies-camden-box-t-shirt-in-green/203369529-1-green,dickies camden box tshirt in green,"['dickies', 'camden', 'box', 'tshirt', 'in', 'green']","['dickies', 'camden', 'box', 'tshirt', 'green']","[('dickies', 'n'), ('camden', 'n'), ('box', 'n'), ('tshirt', 'n'), ('green', 'n')]","['dicky', 'camden', 'box', 'tshirt', 'green']",dicky camden box tshirt green
903,ASOS DESIGN jersey polo in beige,ASOS DESIGN,SHIFTING SAND,images.asos-media.com/products/asos-design-jersey-polo-in-beige/201973416-1-shiftingsand,asos design jersey polo in beige,"['asos', 'design', 'jersey', 'polo', 'in', 'beige']","['asos', 'design', 'jersey', 'polo', 'beige']","[('asos', 'n'), ('design', 'n'), ('jersey', 'n'), ('polo', 'n'), ('beige', 'n')]","['asos', 'design', 'jersey', 'polo', 'beige']",asos design jersey polo beige
904,Vans Torrey jacket in green Exclusive at ASOS,Vans,GREEN,images.asos-media.com/products/vans-torrey-jacket-in-green-exclusive-at-asos/203238622-1-green,vans torrey jacket in green exclusive at asos,"['vans', 'torrey', 'jacket', 'in', 'green', 'exclusive', 'at', 'asos']","['vans', 'torrey', 'jacket', 'green', 'exclusive', 'asos']","[('vans', 'n'), ('torrey', 'n'), ('jacket', 'n'), ('green', 'n'), ('exclusive', 'a'), ('asos', 'n')]","['van', 'torrey', 'jacket', 'green', 'exclusive', 'asos']",van torrey jacket green exclusive asos
905,Bershka slim distressed denim shorts in light blue,Bershka,Light Blue,images.asos-media.com/products/bershka-slim-distressed-denim-shorts-in-light-blue/203036439-1-lightblue,bershka slim distressed denim shorts in light blue,"['bershka', 'slim', 'distressed', 'denim', 'shorts', 'in', 'light', 'blue']","['bershka', 'slim', 'distressed', 'denim', 'shorts', 'light', 'blue']","[('bershka', 'n'), ('slim', 'a'), ('distressed', 'n'), ('denim', 'n'), ('shorts', 'n'), ('light', 'a'), ('blue', 'a')]","['bershka', 'slim', 'distressed', 'denim', 'short', 'light', 'blue']",bershka slim distressed denim short light blue
906,Nike max90 circa pack back print graphic t-shirt in crimson,Nike,RED,images.asos-media.com/products/nike-max90-circa-pack-back-print-graphic-t-shirt-in-crimson/202301785-1-red,nike max90 circa pack back print graphic tshirt in crimson,"['nike', 'max90', 'circa', 'pack', 'back', 'print', 'graphic', 'tshirt', 'in', 'crimson']","['nike', 'max90', 'circa', 'pack', 'back', 'print', 'graphic', 'tshirt', 'crimson']","[('nike', 'n'), ('max90', 'n'), ('circa', 'n'), ('pack', 'n'), ('back', 'r'), ('print', 'n'), ('graphic', 'n'), ('tshirt', 'n'), ('crimson', 'a')]","['nike', 'max90', 'circa', 'pack', 'back', 'print', 'graphic', 'tshirt', 'crimson']",nike max90 circa pack back print graphic tshirt crimson
907,Nike Club woven bomber jacket in stone,Nike,Stone,images.asos-media.com/products/nike-club-woven-bomber-jacket-in-stone/203622166-1-stone,nike club woven bomber jacket in stone,"['nike', 'club', 'woven', 'bomber', 'jacket', 'in', 'stone']","['nike', 'club', 'woven', 'bomber', 'jacket', 'stone']","[('nike', 'n'), ('club', 'n'), ('woven', 'n'), ('bomber', 'n'), ('jacket', 'n'), ('stone', 'n')]","['nike', 'club', 'woven', 'bomber', 'jacket', 'stone']",nike club woven bomber jacket stone
908,Reebok shorts in semi orange flare,Reebok,ORANGE FLARE,images.asos-media.com/products/reebok-shorts-in-semi-orange-flare/202124481-1-orangeflare,reebok shorts in semi orange flare,"['reebok', 'shorts', 'in', 'semi', 'orange', 'flare']","['reebok', 'shorts', 'semi', 'orange', 'flare']","[('reebok', 'n'), ('shorts', 'n'), ('semi', 'n'), ('orange', 'a'), ('flare', 'n')]","['reebok', 'short', 'semi', 'orange', 'flare']",reebok short semi orange flare
909,Vans MN printed t-shirt in yellow,Vans,YELLOW,images.asos-media.com/products/vans-mn-printed-t-shirt-in-yellow/203239217-1-yellow,vans mn printed tshirt in yellow,"['vans', 'mn', 'printed', 'tshirt', 'in', 'yellow']","['vans', 'mn', 'printed', 'tshirt', 'yellow']","[('vans', 'n'), ('mn', 'n'), ('printed', 'v'), ('tshirt', 'n'), ('yellow', 'a')]","['van', 'mn', 'print', 'tshirt', 'yellow']",van mn print tshirt yellow
910,Nike Sports Utility zip thru 'pac-a-mac' jacket in cargo khaki,Nike,KHAKI,images.asos-media.com/products/nike-sports-utility-zip-thru-pac-a-mac-jacket-in-cargo-khaki/202985955-1-khaki,nike sports utility zip thru pacamac jacket in cargo khaki,"['nike', 'sports', 'utility', 'zip', 'thru', 'pacamac', 'jacket', 'in', 'cargo', 'khaki']","['nike', 'sports', 'utility', 'zip', 'thru', 'pacamac', 'jacket', 'cargo', 'khaki']","[('nike', 'n'), ('sports', 'n'), ('utility', 'n'), ('zip', 'n'), ('thru', 'n'), ('pacamac', 'n'), ('jacket', 'n'), ('cargo', 'n'), ('khaki', 'n')]","['nike', 'sport', 'utility', 'zip', 'thru', 'pacamac', 'jacket', 'cargo', 'khaki']",nike sport utility zip thru pacamac jacket cargo khaki
911,ASOS DESIGN regular jean in light wash  - LBLUE,ASOS DESIGN,BLUE,images.asos-media.com/products/asos-design-regular-jean-in-light-wash-lblue/202394836-1-blue,asos design regular jean in light wash   lblue,"['asos', 'design', 'regular', 'jean', 'in', 'light', 'wash', 'lblue']","['asos', 'design', 'regular', 'jean', 'light', 'wash', 'lblue']","[('asos', 'n'), ('design', 'n'), ('regular', 'a'), ('jean', 'n'), ('light', 'a'), ('wash', 'v'), ('lblue', 'n')]","['asos', 'design', 'regular', 'jean', 'light', 'wash', 'lblue']",asos design regular jean light wash lblue
912,Columbia Hopedale long sleeve t-shirt in blue Exclusive at ASOS,Columbia,Blue,images.asos-media.com/products/columbia-hopedale-long-sleeve-t-shirt-in-blue-exclusive-at-asos/201625982-1-blue,columbia hopedale long sleeve tshirt in blue exclusive at asos,"['columbia', 'hopedale', 'long', 'sleeve', 'tshirt', 'in', 'blue', 'exclusive', 'at', 'asos']","['columbia', 'hopedale', 'long', 'sleeve', 'tshirt', 'blue', 'exclusive', 'asos']","[('columbia', 'n'), ('hopedale', 'n'), ('long', 'a'), ('sleeve', 'n'), ('tshirt', 'n'), ('blue', 'a'), ('exclusive', 'a'), ('asos', 'n')]","['columbia', 'hopedale', 'long', 'sleeve', 'tshirt', 'blue', 'exclusive', 'asos']",columbia hopedale long sleeve tshirt blue exclusive asos
913,ASOS DESIGN skinny tuxedo in black suit trousers,ASOS DESIGN,Black,images.asos-media.com/products/asos-design-skinny-tuxedo-in-black-suit-trousers/23616101-1-black,asos design skinny tuxedo in black suit trousers,"['asos', 'design', 'skinny', 'tuxedo', 'in', 'black', 'suit', 'trousers']","['asos', 'design', 'skinny', 'tuxedo', 'black', 'suit', 'trousers']","[('asos', 'n'), ('design', 'n'), ('skinny', 'n'), ('tuxedo', 'n'), ('black', 'a'), ('suit', 'n'), ('trousers', 'n')]","['asos', 'design', 'skinny', 'tuxedo', 'black', 'suit', 'trouser']",asos design skinny tuxedo black suit trouser
914,adidas Running Fast split shorts in royal blue,adidas performance,MID BLUE,images.asos-media.com/products/adidas-running-fast-split-shorts-in-royal-blue/202145448-1-midblue,adidas running fast split shorts in royal blue,"['adidas', 'running', 'fast', 'split', 'shorts', 'in', 'royal', 'blue']","['adidas', 'running', 'fast', 'split', 'shorts', 'royal', 'blue']","[('adidas', 'n'), ('running', 'v'), ('fast', 'r'), ('split', 'v'), ('shorts', 'n'), ('royal', 'a'), ('blue', 'a')]","['adidas', 'run', 'fast', 'split', 'short', 'royal', 'blue']",adidas run fast split short royal blue
915,New Look chicago t-shirt in grey,New Look,Grey NIU,images.asos-media.com/products/new-look-chicago-t-shirt-in-grey/203378759-1-greyniu,new look chicago tshirt in grey,"['new', 'look', 'chicago', 'tshirt', 'in', 'grey']","['new', 'look', 'chicago', 'tshirt', 'grey']","[('new', 'a'), ('look', 'n'), ('chicago', 'n'), ('tshirt', 'n'), ('grey', 'n')]","['new', 'look', 'chicago', 'tshirt', 'grey']",new look chicago tshirt grey
916,Topman oversized t-shirt with placement text embroidery in stone,Topman,NEUTRAL,images.asos-media.com/products/topman-oversized-t-shirt-with-placement-text-embroidery-in-stone/203136504-1-neutral,topman oversized tshirt with placement text embroidery in stone,"['topman', 'oversized', 'tshirt', 'with', 'placement', 'text', 'embroidery', 'in', 'stone']","['topman', 'oversized', 'tshirt', 'placement', 'text', 'embroidery', 'stone']","[('topman', 'n'), ('oversized', 'n'), ('tshirt', 'n'), ('placement', 'n'), ('text', 'n'), ('embroidery', 'n'), ('stone', 'n')]","['topman', 'oversized', 'tshirt', 'placement', 'text', 'embroidery', 'stone']",topman oversized tshirt placement text embroidery stone
917,adidas Golf Ottoman stripe polo shirt in navy,adidas Golf,NAVY,images.asos-media.com/products/adidas-golf-ottoman-stripe-polo-shirt-in-navy/202833020-1-navy,adidas golf ottoman stripe polo shirt in navy,"['adidas', 'golf', 'ottoman', 'stripe', 'polo', 'shirt', 'in', 'navy']","['adidas', 'golf', 'ottoman', 'stripe', 'polo', 'shirt', 'navy']","[('adidas', 'n'), ('golf', 'n'), ('ottoman', 'n'), ('stripe', 'n'), ('polo', 'n'), ('shirt', 'n'), ('navy', 'n')]","['adidas', 'golf', 'ottoman', 'stripe', 'polo', 'shirt', 'navy']",adidas golf ottoman stripe polo shirt navy
918,ASOS DESIGN swim thong in animal print,ASOS DESIGN,Multi,images.asos-media.com/products/asos-design-swim-thong-in-animal-print/202697818-1-multi,asos design swim thong in animal print,"['asos', 'design', 'swim', 'thong', 'in', 'animal', 'print']","['asos', 'design', 'swim', 'thong', 'animal', 'print']","[('asos', 'n'), ('design', 'n'), ('swim', 'n'), ('thong', 'n'), ('animal', 'n'), ('print', 'n')]","['asos', 'design', 'swim', 'thong', 'animal', 'print']",asos design swim thong animal print
919,Topman relaxed co-ord  cut and sew cargo trousers with elasticated waist  in khaki,Topman,Khaki,images.asos-media.com/products/topman-relaxed-co-ord-cut-and-sew-cargo-trousers-with-elasticated-waist-in-khaki/202236866-1-khaki,topman relaxed coord  cut and sew cargo trousers with elasticated waist  in khaki,"['topman', 'relaxed', 'coord', 'cut', 'and', 'sew', 'cargo', 'trousers', 'with', 'elasticated', 'waist', 'in', 'khaki']","['topman', 'relaxed', 'coord', 'cut', 'sew', 'cargo', 'trousers', 'elasticated', 'waist', 'khaki']","[('topman', 'n'), ('relaxed', 'n'), ('coord', 'n'), ('cut', 'v'), ('sew', 'n'), ('cargo', 'n'), ('trousers', 'n'), ('elasticated', 'n'), ('waist', 'n'), ('khaki', 'n')]","['topman', 'relaxed', 'coord', 'cut', 'sew', 'cargo', 'trouser', 'elasticated', 'waist', 'khaki']",topman relaxed coord cut sew cargo trouser elasticated waist khaki
920,Under Armour Legacy windbreaker jacket in black,Under Armour,BLACK,images.asos-media.com/products/under-armour-legacy-windbreaker-jacket-in-black/203966028-1-black,under armour legacy windbreaker jacket in black,"['under', 'armour', 'legacy', 'windbreaker', 'jacket', 'in', 'black']","['armour', 'legacy', 'windbreaker', 'jacket', 'black']","[('armour', 'n'), ('legacy', 'n'), ('windbreaker', 'n'), ('jacket', 'n'), ('black', 'a')]","['armour', 'legacy', 'windbreaker', 'jacket', 'black']",armour legacy windbreaker jacket black
921,ASOS DESIGN spray on jeans with power stretch in acid wash blue with knee rips,ASOS DESIGN,Mid Wash Blue,images.asos-media.com/products/asos-design-spray-on-jeans-with-power-stretch-in-acid-wash-blue-with-knee-rips/201906739-1-midwashblue,asos design spray on jeans with power stretch in acid wash blue with knee rips,"['asos', 'design', 'spray', 'on', 'jeans', 'with', 'power', 'stretch', 'in', 'acid', 'wash', 'blue', 'with', 'knee', 'rips']","['asos', 'design', 'spray', 'jeans', 'power', 'stretch', 'acid', 'wash', 'blue', 'knee', 'rips']","[('asos', 'n'), ('design', 'n'), ('spray', 'n'), ('jeans', 'n'), ('power', 'n'), ('stretch', 'v'), ('acid', 'n'), ('wash', 'v'), ('blue', 'a'), ('knee', 'n'), ('rips', 'n')]","['asos', 'design', 'spray', 'jean', 'power', 'stretch', 'acid', 'wash', 'blue', 'knee', 'rip']",asos design spray jean power stretch acid wash blue knee rip
922,New Look short sleeve muscle fit jersey shirt in light blue,New Look,Light Blue,images.asos-media.com/products/new-look-short-sleeve-muscle-fit-jersey-shirt-in-light-blue/203324854-1-lightblue,new look short sleeve muscle fit jersey shirt in light blue,"['new', 'look', 'short', 'sleeve', 'muscle', 'fit', 'jersey', 'shirt', 'in', 'light', 'blue']","['new', 'look', 'short', 'sleeve', 'muscle', 'fit', 'jersey', 'shirt', 'light', 'blue']","[('new', 'a'), ('look', 'n'), ('short', 'a'), ('sleeve', 'n'), ('muscle', 'n'), ('fit', 'a'), ('jersey', 'n'), ('shirt', 'n'), ('light', 'a'), ('blue', 'a')]","['new', 'look', 'short', 'sleeve', 'muscle', 'fit', 'jersey', 'shirt', 'light', 'blue']",new look short sleeve muscle fit jersey shirt light blue
923,Nike french terry shorts in navy ombre,Nike,NAVY,images.asos-media.com/products/nike-french-terry-shorts-in-navy-ombre/202294303-1-navy,nike french terry shorts in navy ombre,"['nike', 'french', 'terry', 'shorts', 'in', 'navy', 'ombre']","['nike', 'french', 'terry', 'shorts', 'navy', 'ombre']","[('nike', 'n'), ('french', 'n'), ('terry', 'n'), ('shorts', 'n'), ('navy', 'n'), ('ombre', 'n')]","['nike', 'french', 'terry', 'short', 'navy', 'ombre']",nike french terry short navy ombre
