,Name,Brand,Colour,url,clean_text,tokenized,stopwords_removed,combined_postag_wnet,lemmatize_word_w_pos,lemmatize_text
284,Under Armour Running Qualifier 2.0 half zip reflective top in white,Under Armour,WHITE,images.asos-media.com/products/under-armour-running-qualifier-20-half-zip-reflective-top-in-white/202766569-1-white,under armour running qualifier 20 half zip reflective top in white,"['under', 'armour', 'running', 'qualifier', '20', 'half', 'zip', 'reflective', 'top', 'in', 'white']","['armour', 'running', 'qualifier', '20', 'half', 'zip', 'reflective', 'top', 'white']","[('armour', 'n'), ('running', 'v'), ('qualifier', 'n'), ('20', 'n'), ('half', 'n'), ('zip', 'n'), ('reflective', 'n'), ('top', 'n'), ('white', 'a')]","['armour', 'run', 'qualifier', '20', 'half', 'zip', 'reflective', 'top', 'white']",armour run qualifier 20 half zip reflective top white
285,ASOS DESIGN deep revere shirt in black and white floral print,ASOS DESIGN,BLACK,images.asos-media.com/products/asos-design-deep-revere-shirt-in-black-and-white-floral-print/202695442-1-black,asos design deep revere shirt in black and white floral print,"['asos', 'design', 'deep', 'revere', 'shirt', 'in', 'black', 'and', 'white', 'floral', 'print']","['asos', 'design', 'deep', 'revere', 'shirt', 'black', 'white', 'floral', 'print']","[('asos', 'n'), ('design', 'n'), ('deep', 'r'), ('revere', 'n'), ('shirt', 'n'), ('black', 'a'), ('white', 'a'), ('floral', 'n'), ('print', 'n')]","['asos', 'design', 'deep', 'revere', 'shirt', 'black', 'white', 'floral', 'print']",asos design deep revere shirt black white floral print
286,ASOS DESIGN boxy oversized revere shirt with back print,ASOS DESIGN,WHITE,images.asos-media.com/products/asos-design-boxy-oversized-revere-shirt-with-back-print/202579506-1-white,asos design boxy oversized revere shirt with back print,"['asos', 'design', 'boxy', 'oversized', 'revere', 'shirt', 'with', 'back', 'print']","['asos', 'design', 'boxy', 'oversized', 'revere', 'shirt', 'back', 'print']","[('asos', 'n'), ('design', 'n'), ('boxy', 'a'), ('oversized', 'n'), ('revere', 'n'), ('shirt', 'n'), ('back', 'r'), ('print', 'n')]","['asos', 'design', 'boxy', 'oversized', 'revere', 'shirt', 'back', 'print']",asos design boxy oversized revere shirt back print
287,Topman relaxed nylon zip pocket cargo shorts  in purple,Topman,Lilac,images.asos-media.com/products/topman-relaxed-nylon-zip-pocket-cargo-shorts-in-purple/201859265-1-lilac,topman relaxed nylon zip pocket cargo shorts  in purple,"['topman', 'relaxed', 'nylon', 'zip', 'pocket', 'cargo', 'shorts', 'in', 'purple']","['topman', 'relaxed', 'nylon', 'zip', 'pocket', 'cargo', 'shorts', 'purple']","[('topman', 'n'), ('relaxed', 'n'), ('nylon', 'n'), ('zip', 'n'), ('pocket', 'n'), ('cargo', 'n'), ('shorts', 'n'), ('purple', 'a')]","['topman', 'relaxed', 'nylon', 'zip', 'pocket', 'cargo', 'short', 'purple']",topman relaxed nylon zip pocket cargo short purple
288,Selected Homme revere short sleeve shirt in white viscose,Selected Homme,Cloud Dancer,images.asos-media.com/products/selected-homme-revere-short-sleeve-shirt-in-white-viscose/202942337-1-clouddancer,selected homme revere short sleeve shirt in white viscose,"['selected', 'homme', 'revere', 'short', 'sleeve', 'shirt', 'in', 'white', 'viscose']","['selected', 'homme', 'revere', 'short', 'sleeve', 'shirt', 'white', 'viscose']","[('selected', 'v'), ('homme', 'n'), ('revere', 'n'), ('short', 'a'), ('sleeve', 'n'), ('shirt', 'n'), ('white', 'a'), ('viscose', 'n')]","['select', 'homme', 'revere', 'short', 'sleeve', 'shirt', 'white', 'viscose']",select homme revere short sleeve shirt white viscose
289,ASOS DESIGN skinny linen mix suit trousers in pink,ASOS DESIGN,PINK,images.asos-media.com/products/asos-design-skinny-linen-mix-suit-trousers-in-pink/201580136-1-pink,asos design skinny linen mix suit trousers in pink,"['asos', 'design', 'skinny', 'linen', 'mix', 'suit', 'trousers', 'in', 'pink']","['asos', 'design', 'skinny', 'linen', 'mix', 'suit', 'trousers', 'pink']","[('asos', 'n'), ('design', 'n'), ('skinny', 'n'), ('linen', 'n'), ('mix', 'n'), ('suit', 'n'), ('trousers', 'n'), ('pink', 'a')]","['asos', 'design', 'skinny', 'linen', 'mix', 'suit', 'trouser', 'pink']",asos design skinny linen mix suit trouser pink
290,ASOS DESIGN chunky lace up boots with padded collar in stone faux leather,ASOS DESIGN,STONE,images.asos-media.com/products/asos-design-chunky-lace-up-boots-with-padded-collar-in-stone-faux-leather/202670105-1-stone,asos design chunky lace up boots with padded collar in stone faux leather,"['asos', 'design', 'chunky', 'lace', 'up', 'boots', 'with', 'padded', 'collar', 'in', 'stone', 'faux', 'leather']","['asos', 'design', 'chunky', 'lace', 'boots', 'padded', 'collar', 'stone', 'faux', 'leather']","[('asos', 'n'), ('design', 'n'), ('chunky', 'n'), ('lace', 'n'), ('boots', 'n'), ('padded', 'n'), ('collar', 'n'), ('stone', 'n'), ('faux', 'n'), ('leather', 'n')]","['asos', 'design', 'chunky', 'lace', 'boot', 'padded', 'collar', 'stone', 'faux', 'leather']",asos design chunky lace boot padded collar stone faux leather
291,Topman long sleeve grey stretch formal shirt,Topman,GREY,images.asos-media.com/products/topman-long-sleeve-grey-stretch-formal-shirt/203704378-1-grey,topman long sleeve grey stretch formal shirt,"['topman', 'long', 'sleeve', 'grey', 'stretch', 'formal', 'shirt']","['topman', 'long', 'sleeve', 'grey', 'stretch', 'formal', 'shirt']","[('topman', 'n'), ('long', 'a'), ('sleeve', 'n'), ('grey', 'n'), ('stretch', 'v'), ('formal', 'a'), ('shirt', 'n')]","['topman', 'long', 'sleeve', 'grey', 'stretch', 'formal', 'shirt']",topman long sleeve grey stretch formal shirt
292,Topman formal slim fit sateen shirt in white,Topman,WHITE,images.asos-media.com/products/topman-formal-slim-fit-sateen-shirt-in-white/203571831-1-white,topman formal slim fit sateen shirt in white,"['topman', 'formal', 'slim', 'fit', 'sateen', 'shirt', 'in', 'white']","['topman', 'formal', 'slim', 'fit', 'sateen', 'shirt', 'white']","[('topman', 'n'), ('formal', 'a'), ('slim', 'a'), ('fit', 'a'), ('sateen', 'n'), ('shirt', 'n'), ('white', 'a')]","['topman', 'formal', 'slim', 'fit', 'sateen', 'shirt', 'white']",topman formal slim fit sateen shirt white
293,ASOS DESIGN lace up boot in brown leather with white wedge sole,ASOS DESIGN,BROWN,images.asos-media.com/products/asos-design-lace-up-boot-in-brown-leather-with-white-wedge-sole/203024433-1-brown,asos design lace up boot in brown leather with white wedge sole,"['asos', 'design', 'lace', 'up', 'boot', 'in', 'brown', 'leather', 'with', 'white', 'wedge', 'sole']","['asos', 'design', 'lace', 'boot', 'brown', 'leather', 'white', 'wedge', 'sole']","[('asos', 'n'), ('design', 'n'), ('lace', 'n'), ('boot', 'n'), ('brown', 'a'), ('leather', 'n'), ('white', 'a'), ('wedge', 'n'), ('sole', 'n')]","['asos', 'design', 'lace', 'boot', 'brown', 'leather', 'white', 'wedge', 'sole']",asos design lace boot brown leather white wedge sole
294,ASOS DESIGN dropped shoulder oversized revere satin shirt in brown floral,ASOS DESIGN,BROWN,images.asos-media.com/products/asos-design-dropped-shoulder-oversized-revere-satin-shirt-in-brown-floral/202921312-1-brown,asos design dropped shoulder oversized revere satin shirt in brown floral,"['asos', 'design', 'dropped', 'shoulder', 'oversized', 'revere', 'satin', 'shirt', 'in', 'brown', 'floral']","['asos', 'design', 'dropped', 'shoulder', 'oversized', 'revere', 'satin', 'shirt', 'brown', 'floral']","[('asos', 'n'), ('design', 'n'), ('dropped', 'v'), ('shoulder', 'n'), ('oversized', 'n'), ('revere', 'n'), ('satin', 'n'), ('shirt', 'n'), ('brown', 'a'), ('floral', 'n')]","['asos', 'design', 'drop', 'shoulder', 'oversized', 'revere', 'satin', 'shirt', 'brown', 'floral']",asos design drop shoulder oversized revere satin shirt brown floral
295,Icon Brand stainless steel chain bracelet plated in 14k gold,Icon Brand,Gold,images.asos-media.com/products/icon-brand-stainless-steel-chain-bracelet-plated-in-14k-gold/202878405-1-gold,icon brand stainless steel chain bracelet plated in 14k gold,"['icon', 'brand', 'stainless', 'steel', 'chain', 'bracelet', 'plated', 'in', '14k', 'gold']","['icon', 'brand', 'stainless', 'steel', 'chain', 'bracelet', 'plated', '14k', 'gold']","[('icon', 'n'), ('brand', 'n'), ('stainless', 'n'), ('steel', 'n'), ('chain', 'n'), ('bracelet', 'n'), ('plated', 'n'), ('14k', 'n'), ('gold', 'a')]","['icon', 'brand', 'stainless', 'steel', 'chain', 'bracelet', 'plated', '14k', 'gold']",icon brand stainless steel chain bracelet plated 14k gold
296,Nike Yoga Artist in Residence printed woven shorts in green,Nike Training,Green,images.asos-media.com/products/nike-yoga-artist-in-residence-printed-woven-shorts-in-green/200980619-1-green,nike yoga artist in residence printed woven shorts in green,"['nike', 'yoga', 'artist', 'in', 'residence', 'printed', 'woven', 'shorts', 'in', 'green']","['nike', 'yoga', 'artist', 'residence', 'printed', 'woven', 'shorts', 'green']","[('nike', 'n'), ('yoga', 'n'), ('artist', 'n'), ('residence', 'n'), ('printed', 'v'), ('woven', 'n'), ('shorts', 'n'), ('green', 'n')]","['nike', 'yoga', 'artist', 'residence', 'print', 'woven', 'short', 'green']",nike yoga artist residence print woven short green
297,Noak 'Camden' slim premium fabric suit waistcoat in navy with stretch,Noak,NAVY,images.asos-media.com/products/noak-camden-slim-premium-fabric-suit-waistcoat-in-navy-with-stretch/202762932-1-navy,noak camden slim premium fabric suit waistcoat in navy with stretch,"['noak', 'camden', 'slim', 'premium', 'fabric', 'suit', 'waistcoat', 'in', 'navy', 'with', 'stretch']","['noak', 'camden', 'slim', 'premium', 'fabric', 'suit', 'waistcoat', 'navy', 'stretch']","[('noak', 'n'), ('camden', 'n'), ('slim', 'a'), ('premium', 'n'), ('fabric', 'n'), ('suit', 'n'), ('waistcoat', 'n'), ('navy', 'n'), ('stretch', 'v')]","['noak', 'camden', 'slim', 'premium', 'fabric', 'suit', 'waistcoat', 'navy', 'stretch']",noak camden slim premium fabric suit waistcoat navy stretch
298,ASOS DESIGN slim suit jacket in chocolate,ASOS DESIGN,BROWN,images.asos-media.com/products/asos-design-slim-suit-jacket-in-chocolate/202919372-1-brown,asos design slim suit jacket in chocolate,"['asos', 'design', 'slim', 'suit', 'jacket', 'in', 'chocolate']","['asos', 'design', 'slim', 'suit', 'jacket', 'chocolate']","[('asos', 'n'), ('design', 'n'), ('slim', 'a'), ('suit', 'n'), ('jacket', 'n'), ('chocolate', 'n')]","['asos', 'design', 'slim', 'suit', 'jacket', 'chocolate']",asos design slim suit jacket chocolate
299,New Look utah state t-shirt in blue,New Look,Mid Blue,images.asos-media.com/products/new-look-utah-state-t-shirt-in-blue/203669212-1-midblue,new look utah state tshirt in blue,"['new', 'look', 'utah', 'state', 'tshirt', 'in', 'blue']","['new', 'look', 'utah', 'state', 'tshirt', 'blue']","[('new', 'a'), ('look', 'n'), ('utah', 'n'), ('state', 'n'), ('tshirt', 'n'), ('blue', 'a')]","['new', 'look', 'utah', 'state', 'tshirt', 'blue']",new look utah state tshirt blue
300,ASOS DESIGN slim fit oxford shirt with grandad collar in mid grey,ASOS DESIGN,MID GREY,images.asos-media.com/products/asos-design-slim-fit-oxford-shirt-with-grandad-collar-in-mid-grey/202633310-1-midgrey,asos design slim fit oxford shirt with grandad collar in mid grey,"['asos', 'design', 'slim', 'fit', 'oxford', 'shirt', 'with', 'grandad', 'collar', 'in', 'mid', 'grey']","['asos', 'design', 'slim', 'fit', 'oxford', 'shirt', 'grandad', 'collar', 'mid', 'grey']","[('asos', 'n'), ('design', 'n'), ('slim', 'a'), ('fit', 'a'), ('oxford', 'n'), ('shirt', 'n'), ('grandad', 'n'), ('collar', 'n'), ('mid', 'n'), ('grey', 'n')]","['asos', 'design', 'slim', 'fit', 'oxford', 'shirt', 'grandad', 'collar', 'mid', 'grey']",asos design slim fit oxford shirt grandad collar mid grey
301,Nike Club cargo joggers in alligator green,Nike,MGREEN,images.asos-media.com/products/nike-club-cargo-joggers-in-alligator-green/202318833-1-mgreen,nike club cargo joggers in alligator green,"['nike', 'club', 'cargo', 'joggers', 'in', 'alligator', 'green']","['nike', 'club', 'cargo', 'joggers', 'alligator', 'green']","[('nike', 'n'), ('club', 'n'), ('cargo', 'n'), ('joggers', 'n'), ('alligator', 'n'), ('green', 'n')]","['nike', 'club', 'cargo', 'jogger', 'alligator', 'green']",nike club cargo jogger alligator green
302,Topman harrington jacket with borg collar in khaki,Topman,KHAKI,images.asos-media.com/products/topman-harrington-jacket-with-borg-collar-in-khaki/200245580-1-khaki,topman harrington jacket with borg collar in khaki,"['topman', 'harrington', 'jacket', 'with', 'borg', 'collar', 'in', 'khaki']","['topman', 'harrington', 'jacket', 'borg', 'collar', 'khaki']","[('topman', 'n'), ('harrington', 'n'), ('jacket', 'n'), ('borg', 'n'), ('collar', 'n'), ('khaki', 'n')]","['topman', 'harrington', 'jacket', 'borg', 'collar', 'khaki']",topman harrington jacket borg collar khaki
303,ASOS DESIGN super skinny wool mix suit jacket in stone herringbone,ASOS DESIGN,STONE,images.asos-media.com/products/asos-design-super-skinny-wool-mix-suit-jacket-in-stone-herringbone/203153278-1-stone,asos design super skinny wool mix suit jacket in stone herringbone,"['asos', 'design', 'super', 'skinny', 'wool', 'mix', 'suit', 'jacket', 'in', 'stone', 'herringbone']","['asos', 'design', 'super', 'skinny', 'wool', 'mix', 'suit', 'jacket', 'stone', 'herringbone']","[('asos', 'n'), ('design', 'n'), ('super', 'a'), ('skinny', 'n'), ('wool', 'n'), ('mix', 'n'), ('suit', 'n'), ('jacket', 'n'), ('stone', 'n'), ('herringbone', 'n')]","['asos', 'design', 'super', 'skinny', 'wool', 'mix', 'suit', 'jacket', 'stone', 'herringbone']",asos design super skinny wool mix suit jacket stone herringbone
304,Valentino kylo drawstring backpack in black,Valentino Bags,BLACK,images.asos-media.com/products/valentino-kylo-drawstring-backpack-in-black/203066003-1-black,valentino kylo drawstring backpack in black,"['valentino', 'kylo', 'drawstring', 'backpack', 'in', 'black']","['valentino', 'kylo', 'drawstring', 'backpack', 'black']","[('valentino', 'n'), ('kylo', 'n'), ('drawstring', 'n'), ('backpack', 'n'), ('black', 'a')]","['valentino', 'kylo', 'drawstring', 'backpack', 'black']",valentino kylo drawstring backpack black
305,ASOS DESIGN skinny tie in turquoise geo design,ASOS DESIGN,TURQUOISE,images.asos-media.com/products/asos-design-skinny-tie-in-turquoise-geo-design/202965128-1-turquoise,asos design skinny tie in turquoise geo design,"['asos', 'design', 'skinny', 'tie', 'in', 'turquoise', 'geo', 'design']","['asos', 'design', 'skinny', 'tie', 'turquoise', 'geo', 'design']","[('asos', 'n'), ('design', 'n'), ('skinny', 'n'), ('tie', 'n'), ('turquoise', 'n'), ('geo', 'n'), ('design', 'n')]","['asos', 'design', 'skinny', 'tie', 'turquoise', 'geo', 'design']",asos design skinny tie turquoise geo design
306,ASOS DESIGN skinny satin shirt in peach floral jacquard,ASOS DESIGN,ORANGE,images.asos-media.com/products/asos-design-skinny-satin-shirt-in-peach-floral-jacquard/202640481-1-orange,asos design skinny satin shirt in peach floral jacquard,"['asos', 'design', 'skinny', 'satin', 'shirt', 'in', 'peach', 'floral', 'jacquard']","['asos', 'design', 'skinny', 'satin', 'shirt', 'peach', 'floral', 'jacquard']","[('asos', 'n'), ('design', 'n'), ('skinny', 'n'), ('satin', 'n'), ('shirt', 'n'), ('peach', 'n'), ('floral', 'n'), ('jacquard', 'n')]","['asos', 'design', 'skinny', 'satin', 'shirt', 'peach', 'floral', 'jacquard']",asos design skinny satin shirt peach floral jacquard
307,ASOS DESIGN jock strap in animal print,ASOS DESIGN,MULTI,images.asos-media.com/products/asos-design-jock-strap-in-animal-print/201875587-1-multi,asos design jock strap in animal print,"['asos', 'design', 'jock', 'strap', 'in', 'animal', 'print']","['asos', 'design', 'jock', 'strap', 'animal', 'print']","[('asos', 'n'), ('design', 'n'), ('jock', 'n'), ('strap', 'n'), ('animal', 'n'), ('print', 'n')]","['asos', 'design', 'jock', 'strap', 'animal', 'print']",asos design jock strap animal print
308,Bershka chunky chelsea boot in black,Bershka,BLACK,images.asos-media.com/products/bershka-chunky-chelsea-boot-in-black/203957127-1-black,bershka chunky chelsea boot in black,"['bershka', 'chunky', 'chelsea', 'boot', 'in', 'black']","['bershka', 'chunky', 'chelsea', 'boot', 'black']","[('bershka', 'n'), ('chunky', 'n'), ('chelsea', 'n'), ('boot', 'n'), ('black', 'a')]","['bershka', 'chunky', 'chelsea', 'boot', 'black']",bershka chunky chelsea boot black
309,ASOS DESIGN slim fit sateen shirt with ribbon tie neck in white,ASOS DESIGN,WHITE,images.asos-media.com/products/asos-design-slim-fit-sateen-shirt-with-ribbon-tie-neck-in-white/203725450-1-white,asos design slim fit sateen shirt with ribbon tie neck in white,"['asos', 'design', 'slim', 'fit', 'sateen', 'shirt', 'with', 'ribbon', 'tie', 'neck', 'in', 'white']","['asos', 'design', 'slim', 'fit', 'sateen', 'shirt', 'ribbon', 'tie', 'neck', 'white']","[('asos', 'n'), ('design', 'n'), ('slim', 'a'), ('fit', 'a'), ('sateen', 'n'), ('shirt', 'n'), ('ribbon', 'n'), ('tie', 'n'), ('neck', 'n'), ('white', 'a')]","['asos', 'design', 'slim', 'fit', 'sateen', 'shirt', 'ribbon', 'tie', 'neck', 'white']",asos design slim fit sateen shirt ribbon tie neck white
310,New Look oversized short sleeve linen mix shirt in light blue,New Look,Light blue,images.asos-media.com/products/new-look-oversized-short-sleeve-linen-mix-shirt-in-light-blue/203225188-1-lightblue,new look oversized short sleeve linen mix shirt in light blue,"['new', 'look', 'oversized', 'short', 'sleeve', 'linen', 'mix', 'shirt', 'in', 'light', 'blue']","['new', 'look', 'oversized', 'short', 'sleeve', 'linen', 'mix', 'shirt', 'light', 'blue']","[('new', 'a'), ('look', 'n'), ('oversized', 'n'), ('short', 'a'), ('sleeve', 'n'), ('linen', 'n'), ('mix', 'n'), ('shirt', 'n'), ('light', 'a'), ('blue', 'a')]","['new', 'look', 'oversized', 'short', 'sleeve', 'linen', 'mix', 'shirt', 'light', 'blue']",new look oversized short sleeve linen mix shirt light blue
311,HIIT training 1/4 zip top with seam detail,HIIT,BLACK,images.asos-media.com/products/hiit-training-1-4-zip-top-with-seam-detail/203027220-1-black,hiit training 14 zip top with seam detail,"['hiit', 'training', '14', 'zip', 'top', 'with', 'seam', 'detail']","['hiit', 'training', '14', 'zip', 'top', 'seam', 'detail']","[('hiit', 'n'), ('training', 'n'), ('14', 'n'), ('zip', 'n'), ('top', 'n'), ('seam', 'n'), ('detail', 'n')]","['hiit', 'training', '14', 'zip', 'top', 'seam', 'detail']",hiit training 14 zip top seam detail
312,ASOS DESIGN Circular Design oversized unisex t-shirt with pocket in cotton blend in beige,ASOS DESIGN,BISCUIT,images.asos-media.com/products/asos-design-circular-design-oversized-unisex-t-shirt-with-pocket-in-cotton-blend-in-beige/202435776-1-biscuit,asos design circular design oversized unisex tshirt with pocket in cotton blend in beige,"['asos', 'design', 'circular', 'design', 'oversized', 'unisex', 'tshirt', 'with', 'pocket', 'in', 'cotton', 'blend', 'in', 'beige']","['asos', 'design', 'circular', 'design', 'oversized', 'unisex', 'tshirt', 'pocket', 'cotton', 'blend', 'beige']","[('asos', 'n'), ('design', 'n'), ('circular', 'n'), ('design', 'n'), ('oversized', 'n'), ('unisex', 'n'), ('tshirt', 'n'), ('pocket', 'n'), ('cotton', 'n'), ('blend', 'n'), ('beige', 'n')]","['asos', 'design', 'circular', 'design', 'oversized', 'unisex', 'tshirt', 'pocket', 'cotton', 'blend', 'beige']",asos design circular design oversized unisex tshirt pocket cotton blend beige
313,Carhartt WIP wiston cap in brown,Carhartt WIP,BROWN,images.asos-media.com/products/carhartt-wip-wiston-cap-in-brown/203399891-1-brown,carhartt wip wiston cap in brown,"['carhartt', 'wip', 'wiston', 'cap', 'in', 'brown']","['carhartt', 'wip', 'wiston', 'cap', 'brown']","[('carhartt', 'n'), ('wip', 'n'), ('wiston', 'n'), ('cap', 'n'), ('brown', 'a')]","['carhartt', 'wip', 'wiston', 'cap', 'brown']",carhartt wip wiston cap brown
314,ASOS DESIGN super skinny waistcoat in burgundy,ASOS DESIGN,BURGUNDY,images.asos-media.com/products/asos-design-super-skinny-waistcoat-in-burgundy/203052272-1-burgundy,asos design super skinny waistcoat in burgundy,"['asos', 'design', 'super', 'skinny', 'waistcoat', 'in', 'burgundy']","['asos', 'design', 'super', 'skinny', 'waistcoat', 'burgundy']","[('asos', 'n'), ('design', 'n'), ('super', 'a'), ('skinny', 'n'), ('waistcoat', 'n'), ('burgundy', 'n')]","['asos', 'design', 'super', 'skinny', 'waistcoat', 'burgundy']",asos design super skinny waistcoat burgundy
315,ASOS DESIGN super skinny suit waistcoat in tobacco,ASOS DESIGN,BROWN,images.asos-media.com/products/asos-design-super-skinny-suit-waistcoat-in-tobacco/202919354-1-brown,asos design super skinny suit waistcoat in tobacco,"['asos', 'design', 'super', 'skinny', 'suit', 'waistcoat', 'in', 'tobacco']","['asos', 'design', 'super', 'skinny', 'suit', 'waistcoat', 'tobacco']","[('asos', 'n'), ('design', 'n'), ('super', 'a'), ('skinny', 'n'), ('suit', 'n'), ('waistcoat', 'n'), ('tobacco', 'n')]","['asos', 'design', 'super', 'skinny', 'suit', 'waistcoat', 'tobacco']",asos design super skinny suit waistcoat tobacco
316,Nike Club fleece straight fit joggers in beige,Nike,KHAKI,images.asos-media.com/products/nike-club-fleece-straight-fit-joggers-in-beige/202320838-1-khaki,nike club fleece straight fit joggers in beige,"['nike', 'club', 'fleece', 'straight', 'fit', 'joggers', 'in', 'beige']","['nike', 'club', 'fleece', 'straight', 'fit', 'joggers', 'beige']","[('nike', 'n'), ('club', 'n'), ('fleece', 'n'), ('straight', 'r'), ('fit', 'a'), ('joggers', 'n'), ('beige', 'n')]","['nike', 'club', 'fleece', 'straight', 'fit', 'jogger', 'beige']",nike club fleece straight fit jogger beige
317,ASOS DESIGN skinny viscose shirt in beige,ASOS DESIGN,STONE,images.asos-media.com/products/asos-design-skinny-viscose-shirt-in-beige/201931904-1-stone,asos design skinny viscose shirt in beige,"['asos', 'design', 'skinny', 'viscose', 'shirt', 'in', 'beige']","['asos', 'design', 'skinny', 'viscose', 'shirt', 'beige']","[('asos', 'n'), ('design', 'n'), ('skinny', 'n'), ('viscose', 'n'), ('shirt', 'n'), ('beige', 'n')]","['asos', 'design', 'skinny', 'viscose', 'shirt', 'beige']",asos design skinny viscose shirt beige
318,ASOS DESIGN slim tie in khaki cord,ASOS DESIGN,KHAKI,images.asos-media.com/products/asos-design-slim-tie-in-khaki-cord/202948292-1-khaki,asos design slim tie in khaki cord,"['asos', 'design', 'slim', 'tie', 'in', 'khaki', 'cord']","['asos', 'design', 'slim', 'tie', 'khaki', 'cord']","[('asos', 'n'), ('design', 'n'), ('slim', 'a'), ('tie', 'n'), ('khaki', 'n'), ('cord', 'n')]","['asos', 'design', 'slim', 'tie', 'khaki', 'cord']",asos design slim tie khaki cord
319,Noak Camden' slim premium fabric suit jacket in navy with stretch,Noak,NAVY,images.asos-media.com/products/noak-camden-slim-premium-fabric-suit-jacket-in-navy-with-stretch/202762429-1-navy,noak camden slim premium fabric suit jacket in navy with stretch,"['noak', 'camden', 'slim', 'premium', 'fabric', 'suit', 'jacket', 'in', 'navy', 'with', 'stretch']","['noak', 'camden', 'slim', 'premium', 'fabric', 'suit', 'jacket', 'navy', 'stretch']","[('noak', 'n'), ('camden', 'n'), ('slim', 'a'), ('premium', 'n'), ('fabric', 'n'), ('suit', 'n'), ('jacket', 'n'), ('navy', 'n'), ('stretch', 'v')]","['noak', 'camden', 'slim', 'premium', 'fabric', 'suit', 'jacket', 'navy', 'stretch']",noak camden slim premium fabric suit jacket navy stretch
320,Jack & Jones Chris loose fit jean with knee rips in mid blue,Jack & Jones,Blue Denim,images.asos-media.com/products/jack-jones-chris-loose-fit-jean-with-knee-rips-in-mid-blue/202345120-1-bluedenim,jack  jones chris loose fit jean with knee rips in mid blue,"['jack', 'jones', 'chris', 'loose', 'fit', 'jean', 'with', 'knee', 'rips', 'in', 'mid', 'blue']","['jack', 'jones', 'chris', 'loose', 'fit', 'jean', 'knee', 'rips', 'mid', 'blue']","[('jack', 'n'), ('jones', 'n'), ('chris', 'n'), ('loose', 'a'), ('fit', 'a'), ('jean', 'n'), ('knee', 'n'), ('rips', 'n'), ('mid', 'n'), ('blue', 'a')]","['jack', 'jones', 'chris', 'loose', 'fit', 'jean', 'knee', 'rip', 'mid', 'blue']",jack jones chris loose fit jean knee rip mid blue
321,Reebok Vintage joggers in oatmeal - exclusive to ASOS,Reebok,alabaster,images.asos-media.com/products/reebok-vintage-joggers-in-oatmeal-exclusive-to-asos/202177137-1-alabaster,reebok vintage joggers in oatmeal  exclusive to asos,"['reebok', 'vintage', 'joggers', 'in', 'oatmeal', 'exclusive', 'to', 'asos']","['reebok', 'vintage', 'joggers', 'oatmeal', 'exclusive', 'asos']","[('reebok', 'n'), ('vintage', 'n'), ('joggers', 'n'), ('oatmeal', 'n'), ('exclusive', 'a'), ('asos', 'n')]","['reebok', 'vintage', 'jogger', 'oatmeal', 'exclusive', 'asos']",reebok vintage jogger oatmeal exclusive asos
322,Reebok classics wardrobe essentials rugby polo in black,Reebok,BLACK,images.asos-media.com/products/reebok-classics-wardrobe-essentials-rugby-polo-in-black/202159515-1-black,reebok classics wardrobe essentials rugby polo in black,"['reebok', 'classics', 'wardrobe', 'essentials', 'rugby', 'polo', 'in', 'black']","['reebok', 'classics', 'wardrobe', 'essentials', 'rugby', 'polo', 'black']","[('reebok', 'n'), ('classics', 'n'), ('wardrobe', 'n'), ('essentials', 'n'), ('rugby', 'n'), ('polo', 'n'), ('black', 'a')]","['reebok', 'classic', 'wardrobe', 'essential', 'rugby', 'polo', 'black']",reebok classic wardrobe essential rugby polo black
323,Topman classic knitted fisherman jumper in navy,Topman,Navy,images.asos-media.com/products/topman-classic-knitted-fisherman-jumper-in-navy/200272159-1-navy,topman classic knitted fisherman jumper in navy,"['topman', 'classic', 'knitted', 'fisherman', 'jumper', 'in', 'navy']","['topman', 'classic', 'knitted', 'fisherman', 'jumper', 'navy']","[('topman', 'n'), ('classic', 'a'), ('knitted', 'n'), ('fisherman', 'n'), ('jumper', 'n'), ('navy', 'n')]","['topman', 'classic', 'knitted', 'fisherman', 'jumper', 'navy']",topman classic knitted fisherman jumper navy
